{
  "schemaVersion": 1,
  "type": "omote.devicePack",
  "device": {
    "id": "airconditioner",
    "name": "Air conditioner",
    "manufacturer": "De'Longhi",
    "model": "PAC N81",
    "protocol": "NEC"
  },
  "commands": [
    {
      "name": "AIRCONDITIONER_COMMAND",
      "handler": "IR",
      "payloads": [
        "3"
      ]
    }
  ]
}